[
  {
    "schema_version": 2,
    "identity": {
      "id": "UP-001",
      "definition_version": 1,
      "title": "Bounded nonacceptance for undeclared purposes",
      "category": "universal"
    },
    "explanation": {
      "summary": "Check that a validator does not accept on its undeclared purposes within 5,000,000 CEK steps.",
      "claim": "For each undeclared Plutus V3 purpose, every raw redeemer and every context in the corresponding Every* domain fail to produce unit-valued acceptance with a 5,000,000-step CEK allowance.",
      "purpose": "Detect acceptance on a purpose outside the blueprint's declared handlers when those declarations represent the intended allowed purposes."
    },
    "scope": {
      "relevance_conditions": [
        "The blueprint's declared purposes accurately describe the purposes on which the validator is intended to accept.",
        "Acceptance through a fallback handler on another purpose would violate the intended purpose policy."
      ],
      "preconditions": [],
      "limitations": [
        "Fuel exhaustion satisfies this nonacceptance claim; it does not establish explicit rejection or termination.",
        "No ledger-validity hypothesis is imposed. The quantified transaction contexts can include cases that the ledger would reject.",
        "The current binding supports unparameterized Plutus V3 validators and the generic per-purpose Every* context domains.",
        "The claim does not establish behavior beyond the stated CEK allowance or compliance with ledger CPU and memory budgets.",
        "If every supported purpose has a declared handler, this binding generates no obligations and supplies no passing verdict."
      ]
    },
    "formalization": {
      "primary": "Candidates.UP001.statement",
      "theorems": []
    },
    "references": [
      {
        "label": "Maintained proposition generator and execution binding",
        "target": "formal/Candidates/UP001.lean"
      },
      {
        "label": "Per-purpose context domains and shared evaluation helpers",
        "target": "formal/Formal/Universal/Properties.lean"
      },
      {
        "label": "Original candidate source before the reviewed workflow bound change",
        "target": "https://github.com/no-witness-labs/contracts-library/pull/49"
      }
    ]
  },
  {
    "schema_version": 2,
    "identity": {
      "id": "UP-012",
      "definition_version": 1,
      "title": "Experimental signer-removal rejection",
      "category": "universal"
    },
    "explanation": {
      "summary": "Check bounded explicit rejection after removing the sole signer from the fixed Claim and Cancel integration scenarios.",
      "claim": "For each modeled Claim or Cancel transaction, if the original context satisfies the model's validScriptContext predicate and is accepted within 1,000,000 CEK steps, its signer list is nonempty, and removing its first signer preserves that predicate, the changed context is explicitly rejected within the same bound. Separate action-specific obligations check that the premises have a witness.",
      "purpose": "Exercise signer-removal checks and their applicability qualification in the pinned vesting integration example."
    },
    "scope": {
      "relevance_conditions": [
        "Relevant to acceptance dependence on the sole signer in the original PR #55 Claim and Cancel transaction shapes.",
        "The current workflow binding is an experimental integration test, rather than a general required-signer audit for client validators."
      ],
      "preconditions": [
        "The original modeled context satisfies validScriptContext and is accepted within the 1,000,000-step allowance.",
        "The original signer list is nonempty.",
        "The context with its first signer removed still satisfies validScriptContext."
      ],
      "limitations": [
        "The current binding accepts only the original unparameterized Plutus V3 linear-vesting artifact from PR #55.",
        "The Claim and Cancel shapes each contain one signer. The check does not cover arbitrary transaction shapes or multiple-signer lists.",
        "Explicit bounded rejection excludes fuel exhaustion; the CEK bound is not a ledger CPU or memory budget.",
        "The check does not determine which signatures a protocol ought to require or establish general authorization correctness.",
        "The property and applicability observations establish only statements within the supplied model; they do not establish transaction reachability on a deployed ledger."
      ]
    },
    "formalization": {
      "primary": "Candidates.UP012.checks",
      "theorems": []
    },
    "references": [
      {
        "label": "Maintained original property and applicability proposition generator",
        "target": "formal/Candidates/UP012.lean"
      },
      {
        "label": "Fixed vesting transaction model and compiled-artifact guard",
        "target": "formal/Workflow/Tests/UP012/Profile.lean"
      },
      {
        "label": "Original bounded vesting candidate",
        "target": "https://github.com/no-witness-labs/contracts-library/pull/55"
      }
    ]
  }
]
